PaperID,Bigrams_Title,Bigrams_Abstract
1979702444,integer_linear linear_programming detecting_speech speech_disfluency,detecting_speech speech_disfluency integer_linear linear_programming programming_ilp speech_disfluency disfluency_detection hidden-event_language conditional_random random_field disfluency_label global_constraint negligible_cost le_training training_data
2127540288,entropy_minimization-based minimization-based_data,statistical_n-gram n-gram_language depends_heavily training_text text_material training_text text_match language_modeling modeling_community text_obtainable supplement_sparse sparse_in-domain in-domain_resource text_harvested web_differs n-gram_distribution distribution_match speech_recognition recognition_task vocabulary_medical medical_domain domain_doctor-patient doctor-patient_dialog vocabulary_transcription european_parliamentary parliamentary_plenary plenary_speech speech_epps art_speech speech_recognition speech_recognition perplexity_ppl
2172097231,tightly_packed,tightly_packed compact_implementation read-only_compressed compressed_trie trie_structure fast_on-demand on-demand_paging short_load load_time
2170064493,automatic_semantic semantic_video video_annotation wide_domain domain_video commonsense_knowledgebases,automatic_semantic semantic_video video_annotation framework_detects video_clip video_search search_engine uncontrolled_wide-domain wide-domain_video help_bridge semantic_gap low-level_visual finding_video visual_event free_text text_annotation commonsense_knowledgebases knowledgebases_experiment wide-domain_video video_clip bbc_rush promising_integrity expressing_annotation input_video
2045770122,information_science web_era domain_mapping,information_science symbolic_linguistic numeric_information topic_white white_mccain zhao_strotmann consecutive_period period_1996-2005 linguistic_criterion information_retrieval structuring_pole emerged_webometrics period_1996-2005 1996-2005_evolved period_integrating automatic_summarization information_science persistence_place place_citation monolithic_block block_isolated tenuous_link evolved_internally h-index_google google_scholar open_access manual_labeling mapping_domain domain_knowledge knowledge_structure capturing_emerging emerging_trend
2129305264,user_profile personalise_visual,enormous_volume recording_stored data_centre personalised_retrieval overloading_user retrieving_uninteresting user_modelling modelling_framework latent_semantic semantic_indexing indexing_lsi first-order_logic logic_fol acquire_static dynamic_user user_preference detect_shift user_profile global_domain external_lexical
2154407993,electronic_health health_record record_ehrs semantic_edge visualising_clinical clinical_information,exchanging_medical healthcare_network single_patient visualise_electronic electronic_health health_record record_ehrs assist_physician clinical_task medical_decision-making visualise_clinical clinical_information semantic_web hl7_clinical architecture_cda well-defined_interface help_clinician clinical_finding ha_focused clinical_management glaucoma_worldwide ha_involved involved_health health_professional semantic_web
2151630811,semantic_web integrate_parallel parallel_programming ontology_learning learning_framework,current_growth biomedical_knowledge user_community free_text biomedical_ontology ontology_learning learning_framework gaining_momentum current_overload biomedical_information information_unfortunately computing_resource biomedical_expert trained_terminologists tackle_current current_difficulty low-level_parallel distributed_programming ontology_learning learning_framework formal_semantic effort_involved skeleton-based_parallel parallel_programming
2138945366,text_mining bioinformatics_state,huge_data daunting_task user_text text_mining text_mining text_mining text_mining text_mining text_mining
2181635685,primatial_vote political_party european_parliamentary parliamentary_election election_held,european_parliament parliament_held absolute_novelty political_party independent_candidate candidate_laszlo laszlo_tike political_stage primatial_vote area_urban european_parliament threshold_dp dp_sdp sdp_nlp nlp_ldp independent_laszlo laszlo_tike parliamentary_election romanian_political political_stage political_party minimal_electoral electoral_threshold future_election
2105569368,inventive_knowledge,
2047360869,data_mining,data_mining biomedical_data information_ha ha_greatly greatly_boosted boosted_target omics_era era_target key_step fight_human human_disease biomedical_science molecular_entity gene_protein biomedical_science science_data data_mining mining_refers combine_biological prioritize_target huge_demand data_mining omics_era data_mining microarray_data emerging_data data_mining chemogenomic_data data_mining proteomic_data data_mining data_mining database_integration data_annotation tentative_strategy data_source integrated_text text_mining high-throughput_data integrated_mining pathway_database
2123841154,semantic_representation text_caption aid_sport sport_image image_retrieval,image_caption manual_semantic semantic_annotation discovering_storing visual_information natural_language nlp_framework image_caption unstructured_data proposed_framework text_caption caption_latent latent_semantic semantic_indexing indexing_lsi handle_ontology ontology_imperfection imperfection_experiment experiment_tested
2166054052,global_transformer transformer_optimization numerical_field field_computation,complex_optimum optimum_transformer mixed-integer_nonlinear nonlinear_programming evolutionary_algorithm numerical_electromagnetic thermal_field field_computation transformer_optimization transformer_material material_cost transformer_material conductor_cross-section cross-section_ensuring ensuring_global global_optimum optimum_transformer numerical_field field_computation heuristic_optimization transformer_manufacturing manufacturing_industry
2083401763,dynamic_modelling predictive_control fluid_catalytic catalytic_cracking,predictive_control control_nmpc quasi-infinite-horizon_nonlinear nonlinear_mpc mpc_qihnmpc moving_horizon horizon_estimator estimator_nonlinear nonlinear_mpc mpc_mhe-nmpc fluid_catalytic catalytic_cracking complex_dynamic reactor_regenerator regenerator_fractionator complex_dynamic reactor_regenerator lump_kinetic riser_tight tight_control mhe-nmpc_considers real-time_control control_algorithm practical_nmpc nmpc_implementation parameter_estimation numerical_implementation multiple_shooting shooting_algorithm algorithm_real-time real-time_feasibility simulated_industrial industrial_fccu
2138990422,problem-centric_organization patient_imaging clinical_data,electronic_medical medical_record unstructured_textual textual_information patient_record dense_owing aging_population chronic_disease navigate_patient patient_data improves_efficiency summarizes_clinical clinical_information patient_record gestalt_view organizing_information dimension_ax ax_time disease_progression time_space frontal_lobe lobe_existence natural_language clinical_abnormality symptom_finding organizes_extracted extracted_finding timeline_grid clinical_information information_retrieval acquiring_raw raw_data informed_diagnosis diagnosis_rsna
2023659337,non-english_web web_searching,non-english_language language_web web_searcher non-english_web user_query search_engine researcher_aware monolingual_non-english non-english_web web_retrieval open_issue issue_investigated
1976770038,,natural_language receiving_answer semantic_web ontology_building semantic_search extract_answer natural_language language_query background_ontology
2077293009,ontology-driven_geographic geographic_information information_integration,information_source geographic_information information_domain gi_geographic geographic_information geospatial_information information_repository integrate_information consistent_information referred_proposal geographic_information information_integration integration_focusing
1966066032,teaching_pronoun,assisted_language language_learning human_machine machine_dialogue help_student student_learn ori_language ori_running task-based_conversation language_construction negotiate_meaning target_language language_construction early_version student_cohort personal_pronoun tutorial_scored attended_regular regular_tutorial immediate_post-tests scored_le delayed_post-tests
2154586245,hybrid_phish phish_detection keywords_retrieval,security_threat economic_loss hybrid_phish phish_detection information_extraction information_retrieval detects_phishing phishing_webpage algorithm_exploiting search_engine training_data phishing_signature constantly_appearing comprehensive_experiment diverse_spectrum data_source false_positive true_positive false_positive
2044643314,pervaporation_step,methodology_proposed proposed_earlier investigated_water water_ethanol water_ethanol ethanol_2-propanol pva_pan pan_composite composite_membrane wt_water parameter_estimation mathematical_software simulation_software measured_modelled simulated_data reduce_experimental experimental_work modelling_work experimental_data
2116920598,legal_information information_retrieval ontological_framework,
1525766883,alignment-based_surface,alignment-based_surface called_absp integrates_semantic semantic_information extract_surface
1997328961,,business_enterprise unprecedented_opportunity patent_data data_mining rank_patent licensing_availability reduce_enterprise management_cost cost_unfortunately patent_ranking ranking_software software_named patent_experiment meaningful_ranking indirect_patent metrics--citation_count count_patent patent_status reallife_setting department_lawyer patent_rating highlighting_potentially potentially_valuable valuable_patent patent_cluster
2022229384,semantic_web-based building_personalized personalized_news news_service,proposes_hermes semantic_web-based web-based_framework building_personalized personalized_news news_service knowledge_representation representation_natural natural_language semantic_text semantic_query query_language specifying_wanted wanted_information information_hermes hermes_news news_portal allows_user personalized_online online_access hermes_framework associated_implementation personalized_news news_service semantic_web exploiting_domain domain_information sense_disambiguation express_temporal temporal_constraint
2162480666,malay_linguistic linguistic_text text_steganography,malay_linguistic linguistic_text text_steganography secret_message bahasa_melayu melayu_cover cover_text recipient_whilst whilst_avoiding avoiding_suspicion steganography_algorithm bahasa_melayu grammar_rule semantic_structure bahasa_melayu melayu_stego-text appears_innocuous human_reader steganography_algorithm
2104864900,inter-task_communication overlapping_read write_window deadlock-free_execution cyclic_task task_graph,task_graph task_graph inter-task_communication inter-task_communication first-in-first-out_buffer reordering_task affine_index index_expression communicate_container reordering_task container_delay cyclic_task task_graph circular_buffer overlapping_window deadlock-free_execution cyclic_task task_graph non-affine_index index_expression expression_inside arbitrary_order reordering_task written_location write_window cyclic_task task_graph orthogonal_frequency-division frequency-division_multiplexing multiplexing_ofdm ofdm_receiver non-affine_index index_expression
2056880929,price-directed_decomposition solving_large-scale large-scale_capacitated capacitated_part-routing,production_step routing_flexibility network_flow-based flow-based_linear linear_programming material_handling handling_production outsourcing_cost machine_capacity capacity_limit price-directed_decomposition-based computation_experiment optimal_decision
2119646114,,medical_researcher researcher_formulate current_volume information_ha help_researcher bridge_gap identified_connection researcher_compare informed_algorithm algorithm_choice
2157641143,biomedical_text text_mining,biomedical_text text_mining mining_biotm automated_curation biotm_researcher solve_real-world user_biologist biologist_text text_miner software_developer information_retrieval pubmed_search pdf-to-text_conversion conversion_tokenisation stopword_removal semantic_annotation annotation_schema lexicon-based_annotator user-friendly_annotation annotation_view correct_annotation text_mining supporting_dataset dataset_preparation interoperability_modularity integrating_in-home open-source_third-party component-based_architecture architecture_allows
2005294700,fuzzy_temporal temporal_information historical_event,
1539914019,proposed_architecture built_nlidb,natural_language language_interface database_nlidb formal_query query_language sql_database database_query query_language non-expert_user formal_query nlidb_user natural_language natural_language language_interface interface_interrupter formal_database database_query nlidb_designer static_template query_template query_belong database_schema nlidb_called called_database database_management automatically_build database_schema schema_graph called_mall mall_shopper guide_msg
2072108618,neighboring-extremal_update nonlinear_model-predictive model-predictive_control dynamic_real-time real-time_optimization,nonlinear_model-predictive model-predictive_control control_nmpc dynamic_real-time real-time_optimization optimization_drto complex_nonlinear flexible_operation economic_optimization optimization_criterion solving_dynamic dynamic_optimization neighboring-extremal_update small_perturbation nominal_trajectory parametric_sensitivity marquardt_sensitivity-based closed-loop_dynamic dynamic_optimization rigorous_optimization second-order_sensitivity sensitivity_computed composite_adjoints strong_nonlinearities fast_update nonlinear_optimization updated_sensitivity simulated_semi-batch semi-batch_reactor reactor_demonstrates
2039505355,milp-based_initialization initialization_strategy water-using_network,water_reuse non-convex_nonlinear nonlinear_program program_nlp bilinear_term local_optimization optimization_solver global_optimal mixed_integer integer_linear linear_programming programming_milp starting_point water_stream stream_progress fixed_flowrate fixed_load load_operation linear_subsystem global_optimization optimization_solver solver_baron avoiding_local starting_point fewer_computational computational_resource
2158760468,automatic_image image_categorization,traditional_multimedia multimedia_classification annotated_textual textual_information semantic_gap rough_data challenging_task human_annotation image_tag tag_keywords annotation_describing personal_interesting interesting_information information_describing experiment_demonstrating proposed_categorization
2163592174,,probabilistic_graphical reasonable_conditional conditional_independence independence_assumption marginal_probability mathematical_representation crfs_hmms extracting_semantic
1989111844,extracting_commonsense commonsense_knowledge,commonsense_axiom commonsense_rule rule_referring proposed_algorithm algorithm_search search_automatically axiom_linking seed_commonsense commonsense_rule commonsense_rule commonsense_axiom natural_language
2110693483,sentence-level_event event_classification unstructured_text,correctly_classify classify_sentence natural_language text_summarisation treat_event event_detection text_classification discriminative_versus versus_generative vector_machine machine_svm svm_classifier classifier_versus language_modeling modeling_lm trigger_term die_attack attack_injure injure_meet meet_transport trained_svm svm_classifier language_modeling detailed_error separate_error semantic_inference
2140298320,machine_learning textual_entailment entailment_recognition,learning_textual textual_entailment entailment_recognizers requires_modeling interaction_involved text_fragment supervised_machine machine_learning learning_algorithm derive_first-order first-order_rewrite rewrite_rule shallow_semantic proposed_space space_learn learn_first-order first-order_derivation
2002383178,update_summarization topic_distribution,text_summarization field_ha ha_moved multi-document_summarization update_summarization summarizer_assumes update_summarizer iterative_residual residual_rescaling rescaling_irr latent_semantic semantic_space irr_generalizes generalizes_singular decomposition_svd minor_topic latent_space sentence-extractive_summarization redundancy_novelty prevents_inner
2118707092,recognizing_textual textual_entailment entailment_rational,identifying_textual textual_entailment plausibly_inferred ha_emerged generic_core natural_language language_understanding understanding_work area_ha pascal_recognizing recognizing_textual textual_entailment entailment_rte rte_challenge annual_competitive competitive_meeting current_work strong_tie earlier_line automatic_acquisition lexical_semantic semantic_relationship unsupervised_inference answering_information information_extraction newer_line involved_inference knowledge_representation natural_language language_understanding understanding_challenge context_rte rte_ha ha_fostered growing_community researcher_focused emerging_area
2016702053,constrained_optimization strict_monotonicity,constrained_programming large-scale_nonlinear nonlinear_dynamic explicitly_considered state_constraint predefined_probability joint_probability probability_limit joint_correlated correlated_multivariate multivariate_distribution constrained_programming solving_optimization systematic_methodology strict_monotonic monotonic_relationship constrained_output batch_distillation
1974574160,bmr_benchmarking benchmarking_metric metric_recommender personnel_issue,people_metric service_provision proposed_project project_history unstructured_text stage_firstly firstly_clustering signifies_similarity similarity_secondly parameter_project project_effort effort_project project_duration duration_time time_project project_resource resource_member team_cost comparable_parameter gate_natural natural_language architecture_lastly
2104054531,semantic_restructuring natural_language language_image image_caption image_retrieval,rapid_growth visual_information accessing_visual visual_information user_semantic image_caption image_retrieval natural_language nlp_framework image_caption ontology-based_framework resolve_natural natural_language language_ambiguity proposed_framework ontology_framework tolerate_ambiguity image_caption ontological_framework enhances_image image_retrieval
2136133214,global_economy global_student student_team,ongoing_effort conducting_senior undergraduate_student student_working entrepreneurial_innovative innovative_project multiple_university global_engineering engineering_team develop_complex complex_multidisciplinary targeting_market-related market-related_constraint global_student student_team
2143407219,timeml_compliant compliant_timex timex_tagger,temporal_expression expression_tagger italian_compliant temporal_expression expression_tagger reserved_time wordnet-based_semantic temporal_expression temporal_expression expression_detection
2149259053,multi-institutional_project-centric project-centric_framework teaching_ai,curriculum_project successful_work adaptable_framework core_ai ai_topic adaptable_framework core_ai ai_topic unifying_theme machine_learning twenty-six_project machine_learning network_security security_recommender game_playing playing_computational computational_chemistry chemistry_robotics robotics_conversational cryptography_web classification_vision vision_bioinformatics recognition_data data_mining classroom_experience
2168934454,dissimilarity_algorithm conceptual_graph text_outlier,graphical_text text_representation conceptual_graph text_representation natural_language information_retrieval text_mining dissimilarity_algorithm detect_outlier conceptual_graph graph_interchange graph_matching matching_algorithm dissimilarity_computation real_world world_financial financial_statement identifying_outlying proposed_dissimilarity dice-coefficient_similarity work_experimental human_judgement text_outlier outlier_detection detect_outlier proposed_algorithm algorithm_retains linear_complexity
2050045401,oracle_penalty,
4250821351,practical_lexicography lexicography_atkins,decade_ago lexicographic_community modern_textbook place_corpus lexicographic_enterprise enterprise_written respected_practising practising_lexicographer keywords_lexicography lexicography_learner learner_dictionary dictionary_monolingual monolingual_bilingual bilingual_corpus corpus_frame frame_semantics semantics_english english_french french_textbook
2081326601,neonatal_lipopolysaccharide adult_stress stress_exposure exposure_predisposes predisposes_rat anxiety-like_behaviour blunted_corticosterone,early_life life_genetic environmental_insult neural_predisposition neonatal_lipopolysaccharide lipopolysaccharide_lp lp_exposure anxiety-like_behaviour adult_wistar wistar_rat rat_rat lp_salmonella salmonella_enterica enterica_serotype serotype_enteritidis saline_equivolume life_birth stress_treatment three-day_stress stress_protocol adult_stress underwent_behavioural behavioural_testing anxiety-like_behaviour hide_box box_open open_field field_elevated elevated_plus plus_maze maze_epm acoustic_startle asr_time hide_box box_open open_field automated_tracking tracking_software software_startle startle_amplitude following_behavioural session_peripheral peripheral_blood ass_serum serum_corticosterone lps-treated_animal adulthood_exhibited anxiety-like_behaviour control_sexually sexually_dimorphic male_exhibiting anxiety-related_behaviour neonatal_lp lp_exposure blunted_hpa hpa_axis anxiety-related_behaviour behaviour_demonstrating neonatal_immune immune_activation anxiety-related_behaviour behaviour_following following_stress hpa_axis axis_ontogeny
2001525452,discovering_company company_revenue,online_business business_news news_story story_pertaining company_citation intercompany_network social_network network_structure machine_learning company_revenue quantitative_financial financial_data network_structural predicting_crrs precision_recall company_pair foreign_company financial_data
2071150484,liquid_swelling swelling_constrained constrained_batch batch_reactor recipe_uncertainty,predictive_control control_nmpc simulated_industrial industrial_batch batch_reactor safety_constraint fast_dynamic dynamic_uncertainty industrial_relevance control-relevant_formulation excessive_liquid liquid_rise two-phase_batch batch_reactor recipe_uncertainty control_simulation dedicated_nmpc optimization_software software_toolbox toolbox_optcon numerical_algorithm open-loop_optimal optimal_control arising_nonlinear nonlinear_programming sequential_quadratic quadratic_programming programming_sqp sqp_algorithm algorithm_tailored freeware_optimization optimization_environment environment_hqp nmpc_controller real-time_iteration optcon_implementation implementation_allows allows_small small_sampling sampling_time optimal_operation batch_recipe
2091429683,time_sequence sequence_summarization,time_sequence sequence_summarization massive_data data_source source_time time_sequence sequence_summarization time_sequence chronologically_ordered descriptor_time time_sequence sequence_summarization concise_time time_sequence time_sequence achieves_time time_sequence sequence_summarization generalization_grouping generalization_express express_event event_descriptor grouping_gather input_time time_sequence algorithm_computes ha_reduced reduced_algorithmic algorithmic_complexity concise_representation financial_news
2036383665,language_learning,language_learning language_area grammar_vocabulary vocabulary_reading reading_writing writing_pronunciation pronunciation_listening listening_speaking language_area help_assist language_learner highlight_current current_point draw_attention
1975473772,absorption_cooling,strategy_devised estimated_data real_world absorption_cooling energy_cost stochastic_bi-criteria bi-criteria_non-linear non-linear_optimization financial_risk risk_associated downside_risk proposed_modeling modeling_framework typical_absorption absorption_cooling heat_exchanger absorption_cycle strategy_allows allows_identifying le_sensitive energy_price
2037668705,computer-aided_classification patent_oriented,triz_ha solve_technical engineer_formulates contradiction_matrix matrix_help inventive_principle inventive_principle innovative_problem-solving problem-solving_idea published_patent inventive_principle automatic_patent patent_classification computational_linguistics integrate_text text_mining patent_classification classify_patent patent_according inventive_principle
2148244839,software_requirement,practitioner_spend manage_requirement faithfully_translate free-form_natural natural_language inherent_ambiguity constrained_natural natural_language requirement-specific_heuristic leverage_work requirement_statement ibm_rational rational_software software_architect
2547347856,distributed_qos qos_pricing elastic_internet internet_service,state_estimation internet_traffic traffic_flow flow_control aggregate_bandwidth bandwidth_utility network_source network_link distributed_computation optimization_framework allows_network network_source link_bandwidth bandwidth_price network_state price_feedback network_link communicational_overhead resource_allocation estimation_framework network_management control_hardware hardware_malfunction malfunction_improves improves_network network_monitoring eliminates_anomaly poor_network data_delivery fewer_packet packet_loss optimization_framework turn_improves network_stability reduced_buffer buffer_occupancy congested_link packet_loss service_delay
