PaperID,Bigrams_Title,Bigrams_Abstract
2039165693,spl_delta delta_spl spl_sigma sigma_modulator modulator_topology topology_optimized complexity_sensitivity power_consumption,topology-synthesis_methodology single-loop_single-bit single-bit_spl spl_delta delta_spl spl_sigma sigma_modulators optimal_topology hardware_complexity complexity_modulator modulator_sensitivity power_consumption generic_modulator modulator_architecture feedforward_signal signal_path symbolic_noise noise_transfer signal_transfer generic_topology mixed-integer_nonlinearly nonlinearly_constrained constrained_programming programming_minlp optimal_modulator modulator_topology synthesized_topology traditional_modulator modulator_topology
2047811235,libration_control tethered_satellite elliptical_orbit,librational_motion tethered_satellite elliptic_orbit forced_length controlled_periodic linear_receding receding_horizon horizon_tracking tracking_controller feedack_gain periodic_coefficient control_strategy out-of-plane_dynamic dynamic_closed-loop closed-loop_stability linear_feedback feedback_control control_law feedback_gain
2127724624,learning_object semistructured_web,learning_object object_data data_extracted data-intensive_semistructured semistructured_web modeling_intensive intensive_data object_region object_data object_data data_appearing object_region construct_object object_data hierarchical_xml xml_output analogous_object object_data corresponding_object object_data web_site handcrafted_ontology extract_object object_data semistructured_web kernel-based_matching view_syntax syntax_interpretation automatically_construct construct_object object_data induce_object complicated_web digital_camera camera_downloaded vendor_site hand-crafted_ontology open_corpus extracting_meaningful
1493040495,dual_data,background_data data_mining data_mining pruning_uninteresting knowledge_acquisition acquisition_step automatically_acquiring acquiring_knowledge surprise_score potentially_interesting surprise_score score_capture surprise_score attaching_statistical statistical_significance script_written patient_database citation_knowledgebase disease_entity surprise_score estimated_statistical statistical_significance surprise_score score_matched reducing_dependence knowledge_elicited human_expert rate-limiting_step
2152318938,parole-simple-clips_semantic semantic_layer,qualia_structure predicative_representation semantic_layer clip_lexicon italian_lexical lexical_resource generative_lexicon qualia_structure multifaceted_nature qualia-based_representation linguistic_information information_computationally computationally_usable predicative_representation lexical_predicate selectional_restriction lexical_information entry_semantically retrieving_information semantic_predicate syntactic_frame described_stressing lexical_data semantic_space meaning_dimension qualia_structure predicate_word-senses
2533213870,learning_syntactic syntactic_tree balanced_hungarian hungarian_natural natural_language language_database,largest_manually hungarian_textual textual_database natural_language hand_detailed detailed_information automatic_recognition syntactic_structure machine_learning learning_algorithm numeric_learner pre-defined_parsing
2102830344,situation_management,situation_management big_picture situation_management workshop_topic situation_knowledge knowledge_acquisition acquisition_learning learning_situation situation_recognition recognition_structural structural_behavioral behavioral_modeling sensor_network network_robotic robotic_sensor sensor_mobile mobile_sensor sensor_grid situation_awareness human-centric_situation situation_management situation_management
1975086470,academic_entrepreneurship,inhibiting_entrepreneurship corporate_entrepreneurship entrepreneurship_perspective understanding_academic academic_entrepreneurship university_context adopted_involving purposeful_sampling sampling_strategy academic_entrepreneur academic_finding finding_develops tentative_framework academic_entrepreneurship academic_entrepreneurship knowledge_production limitation_implication setting_limit academic_entrepreneurship entrepreneurship_framework academic_entrepreneurship knowledge_practical practical_implication academic_entrepreneur university_setting academic_entrepreneur policy_maker university_administrator academic_entrepreneurship entrepreneurship_framework
2037890722,optimal_deployment deployment_retrieval orbital_plane,cover_advancement strategic_missile space_science science_space manufacturing_space space_operation
2438784799,evaluating_state-of-the-art state-of-the-art_treebank-style treebank-style_parser,state-of-the-art_parser measuring_text text_cohesion requires_fast syntactic_parsing outline_advantage
2132441788,early_cortical cortical_cell cell_division alnus_incana,work_aimed early_stage chronological_sequence early_stage alnus_incana incana_infected quantify_early early_nodulation nodulation_stage intact_root root_hair-infected hair-infected_actinorhizal actinorhizal_plant incana_plant plant_tissue inoculation_cortical cortical_cell cell_division frankia_cortical cortical_cell cell_division division_area area_prenodules prenodules_nodule nodule_primordium emerging_nodule early_stage stimulated_cell cell_division prenodules_nodule nodule_primordium emerging_nodule inhibited_early early_cell cell_division cell_division division_area nodulation_stage root_length cortical_cell cell_division division_area cortical_cell cell_division
2070042364,fran_ois,fran_ois modern_algebra modern_cryptanalysis mathematical_field obvious_parallel algebra_relies decrypt_coded coded_message aristotelian_term
2330082880,optimal_deployment offset_control spinning_flexible flexible_tethered,space_aperture aperture_sensing ha_spawned connect_multiple multiple_spacecraft keeping_spacecraft flexible_tethered earth_orbit orbital_motion motion_tether tether_elasticity elasticity_damping tension_control control_scheme spinning_tethered numerically_simulated lumped_parameter parameter_representation multiple_tether closed_triangular lateral_tether tether_vibration tether_length offset_control control_strategy lateral_traveling traveling_wave
2010004387,natural_language multilingual_legal legal_advisory,describes_clime web-based_legal legal_advisory multilingual_natural natural_language language_interface interface_clime answer_query ship-operating_regulation core_knowledge knowledge_source regulation_encoded conceptual_domain formalised_legal legal_inference inference_rule legal_inference inference_rule natural_language language_aspect construct_semantically semantically_complex complex_query hybrid_synchronous synchronous_asynchronous asynchronous_dialogue dialogue_structure structure_multilinguality multilinguality_english interface_localisation core_representation local_interaction clime_featured client_involvement natural_language
2067716578,information_mining mining_amp control_amp amp_automation automation_issue,information_mining extraction_viewpoint organizational_knowledge knowledge_manager knowledge_engineer automation_environment environment_develop
1981088598,verba_volant volant_scripta scripta_manent false_axiom virtual_environment semantics_understanding speech-enabled_vr,traditional_interaction virtual_environment menu_force force_user rigidly_sequential sequential_interaction ha_proved speech_recognition recognition_sr sr_allows interaction_resembling human-to-human_communication requires_programmer human_supplied supplied_knowledge spoken_utterance speech_recognition recognition_sr source_code semantic_information work_exploit semantic_richness automatically_adapts human_command command_according semantic_information source_code
2122545791,quantitative_assessment dictionary-based_protein protein_named named_entity entity_tagging,natural_language information_recorded biological_named named_entity entity_tagging tagging_bnet biological_database quantitative_assessment protein_entity gene_protein uniprot_knowledgebase knowledgebase_uniprotkb uniprotkb_entry online_resource
2120803525,novelty_detection,novelty_detection spotting_sentence ordered_sentence task_sentence sentence_appearing novelty_detection computational_nature novelty_community community_novelty partial_overlap overlap_po partial_overlap sentence_cover follows_naturally po-co_computational computational_structure formal_error po-co_framework po_judgment baseline_pool novelty_datasets term_overlap overlap_criterion po_judgment
2320129892,wireless_communication portable_telecardiology rural_health health_care,diagnostic_telecardiology rural_health health_care separate_block patient_bedside portable_ecg ecg_machine machine_interfaced duplex_communication transmitting_ecg ecg_signal cordless_phone rural_health-care health-care_centre incoming_ecg inbuilt_knowledge unknown_abnormality
2070812009,multiplier_convergence,
4249403734,,archibald_national address_term university_student international_communication communication_multilingual bhatia_tej super_language language_american american_popular popular_culture south_asian asian_language language_comic comic_world world_english english_blackwell clark_rose discursive_construction chinese_learner learner_language language_culture curriculum_multilingual coluzzi_paolo language_planning smallest_language language_minority trentino-alto_adige adige_language amp_language language_planning driessen_geert geert_radboud dutch_usage dutch_regional regional_language dialect_language language_culture curriculum_multilingual chinese_learner adopting_english language_culture curriculum_multilingual gao_liwei liwei_monterey lwgao98_yahoo language_contact computer-mediated_communication communication_world world_english english_blackwell amp_michele michele_schweisfurth chinese_learner learner_language language_culture curriculum_multilingual hosoda_yuri yuri_kanagawa yhosoda_kanagawa-u kanagawa-u_ac differential_language language_expertise language_conversation university_press kachru_yamuna mixer_lyricing hinglish_blending indian_pop pop_culture culture_world world_english english_blackwell kenny_colum colum_dublin seeing_minority minority_language language_broadcasting broadcasting_language international_communication communication_multilingual macau_macau macau_english japanese_popular popular_culture j-pop_music music_world world_english english_blackwell omoniyi_tope tope_roehampton omoniyi_roehampton roehampton_ac world_english english_lens globalization_world world_english english_blackwell rourke_bernadette bernadette_dublin expressing_identity lesser-used_language galician_context context_language international_communication communication_multilingual gender_identity intercultural_transformation language_socialisation socialisation_language international_communication communication_multilingual east_asian asian_pop pop_music music_korea world_english english_blackwell spencer-oatey_helen amp_zhaoning zhaoning_xiong xiong_chinese chinese_student student_psychological language_culture curriculum_multilingual struck-soboleva_julia controversy_surrounding surrounding_language language_policy russian_german international_communication communication_multilingual ushioda_ema language_motivation reconfigured_europe europe_access access_identity identity_autonomy ustinova_irina murray_state irina_ustinova ustinova_murraystate emerging_advertising russia_world world_english english_blackwell
2091014931,,natural_language generic_machine machine_learning natural_language speech_recognition recognition_spoken spoken_language language_understanding statistical_machine machine_translation
4229492285,bilevel_optimization,
2139634809,lattice-based_dynamic overlapping_taxonomy epistemic_community,describing_taxonomy taxonomy_evolution epistemic_community agent_sharing formal_framework galois_lattice hierarchically_structured epistemic_community manageable_insightful insightful_taxonomy static_picture capture_stylized field_progress progress_decline decline_specialization specialization_interaction interaction_merging paradigm_emergence epistemic_network
2145827569,learning-based_summarisation,
2164882523,rough-set-based_inference inference_engine ecg_classification,rule-based_rough-set rough-set_decision disease_inference inference_engine electrocardiogram_ecg ecg_record ecg_signal extracted_signal noise_removal qrs_detector r-r_interval ecg_wave r-r_interval isoelectric-level_detection base-line_correction reputed_cardiologist ecg_interpretation ecg_signal rule-based_rough-set rough-set_decision inference_engine disease_identification
2029819673,mark-up_barking,solve_natural-language-understanding ha_led textual_annotation grammar_induction annotation_ha english_text annotatedwith_syntactic syntactic_information ha_inspired annotation_effort effort_corpus temporal_dependency estimated_duration expression_refer treebank_project annotation_task linguistic_task reasonable_agreement agreement_people constituent_structure structure_distinction task_andwere andwere_supervised project_started project_ha annotation_task annotation_schema constituent_structure hear_lively interannotator_agreement annotation_task task_easier multiple_annotation annotation_scheme le_discussed help_isolate interannotator_agreement interannotator_agreement annotator_agreement task_capture interannotator_agreement outside_world world_presumably chicago_pizza united_state
2027679410,terminated_ramp vector_machine nonparametric_data,algorithm_terminated terminated_ramp-support ramp-support_vector vector_machine machine_tr-svm vector_machine classifier_generalized generalized_terminated terminated_ramp separating_oppositely oppositely_labeled labeled_pair training_point algorithm_ha meaningful_geometrical geometrical_interpretation tikhonov_regularization free_parameter empirical_error proposed_algorithm two-layer_network theoretical_bound generalization_error vapnik-chervonenkis_dimension real_data
2153979191,user_preference textual_information,accessing_textual textual_information complex_task user_ha satisfaction_requires helping_user semantic_lexicon searching_information graphical_user user_interface interface_step context_accessing accessing_information
1988325893,semeval-2007_task,coarse-grained_english english_all-words all-words_task coarse_version wordnet_sense sense_inventory sense-tagged_corpus future_direction
2035609946,multi-objective_optimization fuel_oil oil_blending jumping_gene gene_adaptation genetic_algorithm,heavy_fuel fuel_oil oil_hfo heavy_refinery refinery_stream short_residue residue_sr vacuum_distillation clarified_liquid liquid_oil oil_clo fluidized-bed_catalytic catalytic_cracker lighter_stream heavy_cycle cycle_oil oil_hco hco_light light_cycle cycle_oil oil_lco heavy_residual residual_stock fluidity_combustibility fuel_oil fuel_oil oil_blending maximize_profit profit_minimize minimize_quality quality_give-away give-away_maximize maximize_production production_minimize multi-objective_optimization elitist_non-dominated non-dominated_sorting sorting_genetic genetic_algorithm algorithm_nsga-ii non-dominating_equally pareto_optimal fixed-length_macro macro_macro macro_mutation mutation_operator operator_inspired jumping_gene natural_genetics genetics_ha computational_effort computational_effort chemical_engineering
1811040126,ontology_recommendation collaborative_assessment,collaborative_ontology ontology_reuse semantic_domain multiple_automatic automatic_criterion rank_fusion manual_user human_collaborative collaborative_assessment automatic_ontology ontology_retrieval retrieval_strategy collaborative_framework term_according user_query early_experiment ontology_retrieval
2314363820,fast_computation shooting_algorithm dynamic_optimization,solve_optimal optimal_control called_sequential single_shooting interior_point order_adjoint composite_adjoints computational_effort simplicity_restricting single_shooting multiple_shooting
4246659552,question-driven_segmentation lecture_speech speech_text intelligent_e-learning,lecture_video envisioning_intelligent intelligent_e-learning information_seeking lecture_video video_segment user_query dynamic_segmentation lecture_speech speech_text shallow_parsing of-speech_tagging noun_phrase automated_speech speech_recognition recognition_asr asr_transcript sliding-window_algorithm ending_boundary returned_segment segment_phonetic partial_matching automated_speech speech_recognition noun_phrase furthermore_extra extra_knowledge lecture_slide asr_transcript transcript_error error_correction deep_parsing structure_match asr_transcript partial_matching slides-based_asr asr_transcript transcript_correction correction_improves improves_information information_coverage
155336309,flexible_unsupervised unsupervised_pp-attachment semantic_information,classical_nlp prepositional_phrase phrase_attachment attachment_pp-attachment verb_np1 noun_phrase noun_phrase np2_attach world_knowledge sense_disambiguation disambiguation_wsd data_sparsity sparsity_reduction reduction_dsr pp-attachment_resolution training_data data_extracted raw_text n2_tuples training_corpus corpus_teach n2_tuples sense_disambiguation disambiguation_wsd data_sparsity detecting_synonymy training_data data_andwall andwall_street pp-attachment_resolution dsr_phase
2097706866,social_bookmarking social_summarization,social_bookmark search_query snippet-generation_capability search_engine social_summarization
2086318569,geographic_information,nowadays_geographic geographic_information sharing_information obvious_consequence unfortunately_integrating integrating_geographic geographic_information trivial_issue task_non-logic finding_similarity syntactic_analyzes geographic_data integrating_information governmental_entity manage_geographic geographic_information north_patagonia
2107701604,game_theory-based theory-based_pricing pricing_strategy single_multiclass multiclass_job job_allocation allocation_scheme bandwidth-constrained_distributed distributed_computing,distributed_computing bandwidth_constraint designing_cost-optimal cost-optimal_job job_allocation allocation_scheme pricing_strategy job_allocation bandwidth-constrained_distributed strategy_formulates incomplete_information information_alternating-offers alternating-offers_bargaining bargaining_game bandwidth_allocated multiclass_job cost-optimal_job job_allocation allocation_scheme single-class_job communication_delay link_bandwidth adaptive_allocation multiclass_job proposed_algorithm job_allocation allocation_scheme
1565919448,future_agenda,umls_constitutes medical_term shed_light
1987418197,semi-automatic_ontology ontology_extraction,semantic_web encode_knowledge organizing_web web_information constructing_topic automatic_construction extract_topic extracting_semantic semantic_information html_markup web_page editor_tm4l automatically_extract extract_topic website_specified extracted_data
2012221043,rule_ontology ontology_matching,hybrid_extensional asymmetric_matching textual_hierarchy as-sociation_rule rule_paradigm following_idea implication_quality reducing_redundancy hierarchy_indexing indexing_textual owl_ontology
2166298261,efl_learner culture_meet,language_educator assist_l2 l2_learner learner_growth intercultural_competence competence_nonetheless nonetheless_web-based web-based_environment environment_devoted efl_educator innovative_web-based web-based_environment web-based_efl efl_learning learning_environment environment_experiment foreign_culture website_read native_culture on-line_computer-based bilingual_concordancer language_learning intercultural_communication web-based_learning learning_environment student_read answer_comprehension reading_student student_share intercultural_conversation conversation_partner online_forum learning_environment researcher_recruited taiwanese_university university_student informal_interview student_forum forum_entry finding_revealed reading_material dictionary_questionnaire questionnaire_finding finding_showed web-based_learning learning_environment student_forum forum_entry entry_revealed grammatical_error intercultural_learning forum_entry entry_demonstrated intercultural_competence virtual_environment foreign_language intercultural_competence
2156133615,coverage-time_optimized optimized_dynamic dynamic_clustering networked_sensor pervasive_home home_networking,energy-efficient_coverage-time coverage-time_optimized optimized_dynamic dynamic_clustering clustering_scheme tiered_wireless wireless_sensor sensor_network network_wsns outdoor_monitoring home_networking cluster_head clustering-based_wsns incomplete_coverage coverage_dc-cto dc-cto_scheme scheme_regulates regulates_cluster cluster_radius balanced_energy energy_consumption maximize_coverage-time dc-cto_scheme balanced_energy energy_consumption minimized_energy energy_consumption perfect_coverage networked_sensing sensing_field perfect_coverage incomplete_coverage perfect_coverage robust_monitoring dc-cto_scheme
2110710657,collaborative_access distributed_diversified diversified_cultural,issue_associated web_portal conceptual_platform online_utility manage_cultural cultural_resource globally_distributed distributed_environment environment_featuring web-based_portal multifaceted_interface virtual_expedition project_combine cutting_edge ontology_engineering semantic_web
2110055256,summarizing_email email_conversation,small_mobile user_email email_summarization email_summarization fragment_quotation quotation_graph email_conversation conversation_summarization called_cws enron_data
1843546927,,latvian_language project_background implementation_aspect nlp_prosody waveform_synthesis traditional_diphone diphone_synthesis adequate_quality
2148670380,ontology_enriched enriched_semantic semantic_annotation cctv_video,semantic_transcoding cctv_video video_footage vision_algorithm extract_visual visual_semantics natural_language automatically_build domain_ontology unstructured_text text_annotation text_semantics routinely_annotate annotate_video video_sequence domain_expert expert_terminology
2171016843,auto-extraction_representation diabetes_ontology bayesian_network,biological_knowledge gene_ontology information_extracted bayesian_network network_trained protein_interaction interaction_data biological_ontology text_mining protein-to-protein_interaction unrelated_information growing_body gene_ontology probabilistic_framework bayesian_network
1991197733,rich_opac opac_user user_interface,open_public public_access access_catalog catalog_opacs user_interface information_seeking seeking_task integrate_user user_assistance rich_environment asynchronous_javascript javascript_xml xml_ajax better_user user_experience modular_architecture natural_language information_seeking manages_query tabbed_interface interface_featuring ajax_query data_grid user_testing
2014761790,lexical_annotation domain_ontology,melis_meaning meaning_elicitation lexical_integration automatic_annotation local_schema relational_database database_schema schema_directory directory_tree lexical_information background_domain domain_knowledge domain_ontology schema_melis melis_ha momis-ontology_builder domain_ontology data_source source_described w3c_language annotated_according momis-ontology_builder builder_framework
2107832396,assessing_collaborative,corresponding_supporting domain_ontology ontology_nlp rule_mining integrated_toolkit comprehensive_functionality portable_versatile assist_researcher discourse_transcript
2146842426,,ontology_search search_ester ester_build query_engine operation_prefix prefix_search compact_index querying_capability sparql_graph-pattern graph-pattern_query operation_ester natural_blend semantic_query ordinary_full-text full-text_query prefix_search search_operation operation_allows proactive_user user_interface keystroke_suggests semantic_interpretation speculatively_executes english_wikipedia yago_ontology complex_query query_ester ester_achieves achieves_worst-case worst-case_query single_machine
2090368477,locating_malevolent malevolent_online,locating_potentially potentially_malevolent malevolent_online popular_keyword keyword_searching law_enforcement google_search search_engine engine_exemplified proof-of-concept_prototype finding_web web_page pipe_bomb traditional_keyword keyword_searching locating_malevolent malevolent_online interactive_online online_information information_exploration
2130706307,,internet_ha ha_dramatically consumer_shop valuable_source image_quality battery_life digital_camera hedonic_regression customer_place text_mining quantitative_impact low-dimension_approximation 15-month_period extract_actionable actionable_business business_intelligence customer_preference textual_portion numeric_data
2039646365,scp_ilink ilink_scp,fundamental_theoretical theoretical_breakthrough social_network social_network peer_production production_style style_collaboration social_network social_search message_routing learning_framework online_peer peer_production social_network network_faqtory full-scale_learning-driven learning-driven_workflow adapting_ilink military_knowledge knowledge_sharing sharing_portal message_routing social_search markov_decision popular_pagerank
2086083453,clustering_search,clustering_search post-processing_step web_search search_engine inside_snippet latent_semantic semantic_indexing strategy_called called_dynamic dynamic_svd svd_clustering svd_computation computation_step step_ha term_vector algorithm_ha search_engine algorithm_ha noodle_search search_engine clustering_web
