PaperID,Bigrams_Title,Bigrams_Abstract
4230976797,,keywords_bridge bridge_river pneumatic_pile pile_pier pier_cost cost_sinking sinking_cylinder medway_medway medway_bridge bridge_kent kent_england
4245992950,gold_ore,
4245258713,,
1970845619,linear_economics,optimal_two-stage two-stage_sampling terminal_act unknown_population stage_depends depends_linearly optimal_sampling sampling_plan statistical_parameter optimal_plan two-stage_sampling sampling_plan
2095520173,frontal_lobe lobe_participation complex_behavior,cytoarchitectonic_organization thalamocortical_projection posterior_cortical cortical_field behavior_act act_extracellular extracellular_recording anterior_frontal frontal_neuronal afferent_activation gyrus_proreus proreus_neuron neuron_complex complex_integrative gigantopyramidal_neurones neurones_posterior posterior_frontal frontal_region observed_participation posterior_frontal frontal_field afferent_synthesis programming_motor phlogenetically_younger younger_anterior anterior_frontal frontal_field nonspecialized_structure structure_posterior posterior_gigantopyramidal gigantopyramidal_field programming_complex complex_motor experimental_situation
2074844781,copper_nickel sea_nodule,
1995442095,,military_coup underdeveloped_society anti-imperialist_regime regime_fell inner_dynamic ghanaian_political political_tribal contradiction_strengthened personal_rivalry rivalry_external imperialist_quarter quarter_notably power_struggle decreasing_international international_significance significance_external external_factor internal_conflits repeated_military military_coup practically_refutes modernizing_developer civilian-military_distinction blurred_according civilian-military_relationship
2128010674,laguerre_polynomial,laguerre_polynomial shift_operator fractional_power definition_ha confluent_hypergeometric
1997960107,interactive_language language_implementation,interactive_language language_implementation language_processor natural_language language_ilis writing_grammar semantic_operator programming_language translation_ilis ha_facility deleting_grammar grammar_rule
2005413808,,numerical_quantum quantum_field date_start euclidean_path path_integral integral_formulation path_integral write_closed albeit_formal quantum_field
2001040729,solvent_screening conceptual_extractive extractive_distillation anhydrous_ethanol fermentation_broth,advertisement_return issueprevarticlenextsolvent_screening conceptual_extractive extractive_distillation anhydrous_ethanol fermentation_brothfu brothfu_ming eng_chem 172publication_date date_print 1985publication_history history_published published_online1 2002published_inissue 1985https_doi doi_org i200028a029rights_permissionsarticle permissionsarticle_views1221altmetric-citations64learn metricsarticle_view counter-compliant_sum regularly_updated reflect_usage usage_leading updated_daily crossref_citation citation_count altmetric_attention attention_score ha_received received_online online_clicking donut_icon altmetric_attention attention_score calculated_share toview_inadd referencesmore_option option_share share_onfacebooktwitterwechatlinked onfacebooktwitterwechatlinked_inreddit inreddit_pdf
60232461,automatic_natural natural_language language_parsing parsing_edited karen_sparck yorick_wilks wilks_elli elli_horwood,automatic_natural natural_language language_parsing essex_england clear_chatty concise_le current_view automatic_nlp
1990394372,neurolinguistic_programming programming_nonsupportive nonsupportive_data,
2078703251,degenerate_quasilinear quasilinear_elliptic elliptic_equation,ensemble_ouvert ouvert_borne aux_limites methode_directe directe_pour pour_etudier telle_equation
2014672397,,
2040407088,,droplet_evaporation gas_phase phase_surrounding spray_evaporation cluster_behavior gas_pressure density_inside describes_cluster cluster_evaporation describes_cluster cluster_evaporation turbulence_enhances enhances_evaporation controlling_factor dense_cluster air_fuel fuel_mass turbulence_history control_evaporation evaporation_time air_fuel fuel_mass density_fall dilute_regime control_evaporation evaporation_time dense_cluster dilute_cluster controlling_factor practical_implication
2113608596,cylinder_pressure internal_combustion combustion_engine,cylinder-pressure_modeling control-oriented_perturbation cylinder_pressure spark-ignited_internation internation_combustion combustion_engine smallest_region linear_perturbation crank_angle angle_frame order_local local_representation cylinder_pressure 8-l_opel opel_family etx_xmlns xmlns_mml mml_http http_www www_w3 w3_org math_mathml mathml_xmlns xmlns_xlink xlink_http http_www www_w3 w3_org
2047642013,natural_language information_retrieval,natural_language information_retrieval young_field graceful_interaction information_retrieval natural_language complex_knowledge-based natural_language information_retrieval knowledge_acquisition
1975402049,,
1966808748,psychological_implication,
2009994584,connectionist_representation,
1969835834,mathematical_isolation hplc_uv resolved_spectrum,overlapping_spectrum hplc_uv-vis experimental_data robust_small small_perturbation alternating_regression overlapping_spectrum random_spectrum starting_point
2114747439,,
4233122065,,
2053749320,intelligent_computer-assistant,
4255665494,machine_learning maturing_field,
4242117347,sequential_generalized generalized_quadratic quadratic_programming programming_algorithm,sequential_generalized generalized_quadratic quadratic_programming programming_algorithm nonlinear_programming inequality_constraint penalty_parameter armijo-type_line line_search order_correction correction_global global_convergence local_superlinear superlinear_convergence proved_numerical
2985774950,artificial_intelligence,
2059825703,logical_reasoning natural_language,
2159250466,frequency-dependent_composite composite_load,aggregate_load load_behavior composite_load rc_circuit induction_motor frequency-dependent_composite composite_load on-line_transient transient_recording parameter_estimation frequency-dependent_load program_called called_lmsp lmsp_ha phase_user-interface user-interface_data data_manipulation manipulation_load dynamic_load load_behavior etx_xmlns xmlns_mml mml_http http_www www_w3 w3_org math_mathml mathml_xmlns xmlns_xlink xlink_http http_www www_w3 w3_org
1515332196,optimal_boundary boundary_control riccati_equation damped_second-order second-order_equation,
2145337913,kemalism_hyper-nationalism,kemalism_hyper-nationalism european_idea idea_vol
2022890244,assisting_requirement requirement_formalization natural_language language_translation,
2062641937,predicate_matching perceived_understanding factual_recall,therapist_communicate verbal_predicate predicate_matching understanding_participant recorded_narrative mismatched_experimental understanding_factual factual_recall subjective_understanding understanding_feeling weakly_supported visual_pr pr_participant
2091635908,hospital_information answering_query patient_discharge,electronic_storage medical_record hospital_information ai_retrieval adequate_information information_retrieval conceptual_knowledge superficial_string string_search natural_language exploit_semantic semantic_conceptual conceptual_knowledge called_conir european_community community_project project_menelas patient_discharge coronary_illness illness_conir flexible_retrieval exploit_conceptual conceptual_context context_information elaborated_semantic semantic_record knowledge_structure
4235887881,,editorialsa_decade decade_laterpublished laterpublished_online aug_1994https 1994https_doi doi_org kb_download download_pdf pdf_toolsexport toolsexport_citationadd favoritesget_permissionstrack permissionstrack_citation citation_shareshare shareshare_onfacebooktwitterlinkedinwechat download_pdf pdf_figuresreferencesrelatedinformation issue_volume volume_9issue 9issue_4august 4august_1994pages 1994pages_151-151 physiological_scienceshttps scienceshttps_doi doi_org 151history_published published_online
4318062352,prairie_progressive progressive_fall,
4236907790,volume_1-5,
2136272467,machine_translation,dominant_framework ariane_metal metal_eurotra carnegie_mellon mellon_university text_corpus bilingual_text parallel_corpus bilingual_lexical lexical_database quality_output controlled_language speech_translation monolingual_user knowing_target target_language structured_database traditionally_associated translation_service
2035868088,language_vision,
2341078838,information_extraction,free_access access_share information_extraction state_univ state_univ crucesview_profile profile_wendy wendy_lehnert lehnert_univ massachusetts_amherst amherst_univ massachusetts_amherstview amherstview_profile acmvolume_39issue 39issue_1jan 1jan_1996pp 91https_doi doi_org 1996publication_history history_381citation6 381citation6_538downloadsmetricstotal 538downloadsmetricstotal_citations381total citations381total_downloads6 downloads6_538last citation_alertsnew alertsnew_citation citation_alert alert_ha chosen_ha alert_preference preference_click alertsnew_citation citation_alert bindernamecancelcreateexport_citationpublisher citationpublisher_siteereaderpdf
2054449314,optimal_retrofit heat_exchanger exchanger_network,systematic_optimisation heat_exchanger exchanger_network multi-task_effort decomposition_scheme mathematical_programming heat_transfer transfer_area retrofitted_network economic_penalty decomposition_stage stage_embed embed_targeting targeting_information optimisation_search
1964414043,feasible_direction structural_optimization,
2051510624,feasible_direction,
1969573631,optimal_planning wind_energy energy_conversion,planning_wind wind_turbine turbine_installation global_energy space_constraint energy_output land_area install_wind wind_turbine installed_turbine better_utilisation
2050512925,newtest_project neural_network s-umts_communication,service_act act_project neural_network satellite_umts umts_channel channel_equalization newtest_project neural_network satellite_communication
2046449425,multiphase_reactor,textbook_knowledge knowledge_originally complex_reaction involving_multiple multiple_phase complicated_kinetics economic_tradeoff work_outline multiphase_reaction systematic_methodology typical_complexity gas-liquid_chlorination
2280354621,enneagram_typology counseling_sex sex_addict,ancient_spiritual spiritual_tradition psychology_describes preoccupation_habit access_point spiritual_growth personality_typology well-defined_direction personal_growth recovery_thirty-three thirty-three_sex sex_addict chemical_dependency addictive_behavior addiction_counselor counselor_working 1-the_perfectionist-were perfectionist-were_overrepresented long-time_recovering recovering_addict 8-the_boss-was boss-was_overrepresented woman_sex sex_addict
4235459484,evaluating_heterodox,evaluating_heterodox access_evan evan_fales fales_evan evan_fales fales_university evan_fales fales_department barry_markovsky markovsky_department sociology_university e-mail_evan-fales evan-fales_uiowa barry-markovsky_uiowa academic_google google_scholar scholar_barry barry_markovsky markovsky_barry barry_markovsky markovsky_university academic_google google_scholar scholar_social social_force force_volume http_doi doi_org
2107223240,sense_disambiguation knowledge_source,sense_disambiguation disambiguation_algorithm lexical_knowledge knowledge_source sense_disambiguation free_text knowledge_source source_semantic semantic_preference preference_dictionary dictionary_definition domain_code part-of-speech_tag tag_optimised learning_algorithm sense_tagged tagged_corpus resource_tested all-word_disambiguation restricting_oneself
2017219217,structural_flowsheet flowsheet_optimization complex_investment investment_cost,complex_investment investment_cost tight_mixed-integer mixed-integer_constraint fixed_structure flowsheet_optimization big-m_formulation structural_optimization generalized_disjunctive disjunctive_programming programming_algorithm algorithm_gdp complex_investment investment_cost gdp_algorithm minlp_subproblems fixed_flowsheet flowsheet_structure milp_master proposed_algorithm vinyl_chloride chloride_monomer monomer_production proposed_gdp gdp_algorithm handling_discontinuity complex_cost structural_flowsheet flowsheet_optimization
1576705061,,ypa_project classified_directory yellow_page classified_database yellow_page hard-to-access_information free_text semi-display_advertisement semi-structured_data data_data le_systematic database_entry logical_clause free_text directory_source source_data data_file file_requires natural_language natural-language-like_construct information_retrieval shallow_knowledge knowledge_deep deep_world world_knowledge project_seek conveniently_simplified simplified_approximation natural_language knowledge_representation source_data data_file ypa_requires semi-structured_data
2952637164,sense_disambiguation knowledge_source,sense_disambiguation disambiguation_algorithm lexical_knowledge knowledge_source sense_disambiguation free_text knowledge_source source_semantic semantic_preference preference_dictionary dictionary_definition domain_code part-of-speech_tag tag_optimised learning_algorithm sense_tagged tagged_corpus resource_tested all-word_disambiguation restricting_oneself
2004844250,stochastic_optimisation,combine_stochastic stochastic_optimisation search_follows group-contribution_expression proposed_methodology liquid-liquid_extraction extraction_solvent molecular_structure
2060480925,citizen_disempowerment parliamentary_election,citizen_disempowerment parliamentary_election democratization_vol
2014481668,write_comment automatic_software software_indexing,natural-language_text source_code proceed_step step_starting storing_profile software_catalog software_catalog locate_reusable
2091830584,hen_synthesis stochastic_optimization mer_optimal optimal_synthesis,heat-exchanger_network network_hen genetic_algorithm algorithm_gas hen_synthesis energy_recovery recovery_mer stream_splitting parametric_optimization heat_load simplex_algorithm meet_mer physically_meaningful meaningful_hen hen_structure structure_representation genetic_operator parametric_optimization simplex_algorithm hen_synthesis arbitrarily_non-linear
1993781803,reaction_pathway pathway_sensitivity,work_focus biochemical_reaction macroscopic_fermentation amplification_attenuation attenuation_factor reaction_step factor_yield reaction_step reaction_network network_bottleneck
2001101999,antipsychotic_drug,
1517219963,global_convergence finding_feasible feasible_point norm-relaxed_mfd,feasible_point infeasible_point feasible_direction direction_mfd global_convergence globally_convergent guarantee_finding feasible_point norm-relaxed_mfd mfd_numerical numerical_experiment norm-relaxed_mfd feasible_point mfd_algorithm nonlinear_programming
1971954723,web_information information_mining mining_algorithm,semi-structured_information extract_structural structural_data data_hidden web_page page_current html_tag user-defined_declarative declarative_language structured_web web_site scalability_wrapper information_source information_mining mining_algorithm semi-structured_information information_experimental web_extracting
2022852306,hidden_dimension paradigmatic_view data-driven_nlp,
2031807043,feasible_direction,feasible_direction ha_root feasible_direction direction_mfd generalized_algorithm algorithm_introduces global_convergence global_convergence algorithm_converges converges_faster norm-relaxed_mfd guaranteed_convergence norm-relaxed_mfd
2127751640,lexical_operator internet_search,natural_language language_interface internet_search search_engine query_answered answered_correctly expands_query postprocesses_retrieved
2161893466,semantic_indexing wordnet_sens,boolean_information information_retrieval building_semantic semantic_representation open_text called_semantic semantic_indexing
2017558614,degenerate_nonlinear nonlinear_programming quadratic_growth,quadratic_growth mangasarian--fromovitz_constraint constraint_qualification qualification_mfcq local_minimum nonlinear_program isolated_stationary stationary_point infty_exact exact_penalty penalty_sequential sequential_quadratic quadratic_programming programming_algorithm r-linear_convergence local_minimum degenerate_nonlinear nonlinear_program local_minimum minimum_satisfying quadratic_growth positive_semidefinite semidefinite_augmented augmented_lagrangian lagrangian_exists nonlinear_programming programming_package
2011521987,quality-driven_machine machine_translation,automatic_scoring machine_translation translation_quality natural_language english_language language_text software_output human-produced_english machine-translation_english
232066182,shopper_commodity commodity_aesthetic aesthetic_modernist modernist_autonomy,
4205909367,,linguistic_computing computing_volume http_doi doi_org
2076819540,systematic_synthesis optimisation_framework,combine_stochastic stochastic_optimisation stochastic_search simulated_annealing annealing_algorithm annealing_algorithm synthesis_search search_molecule molecular_vector synthesis_criterion
1979546513,nonisothermal_synthesis multiphase_reactor reactor_network,nonisothermal_reactor reactor_network challenge_concerning numerous_local tested_methodology profile-based_search search_concentrate unnecessarily_complicated complicated_network develop_simpler
2099913225,,ibm_ha ha_played behave_intelligently intelligently_ibm ibm_today today_carry interdisciplinary_fashion emerging_issue issue_ai broad_area area_knowledge knowledge_representation reasoning_statistical statistical_ai ai_vision game_playing
2169789327,,arbitrary_domain newspaper_corpus annotated_corpus antecedent_discourse discourse_segmentation segmentation_recognizing recognizing_discourse-new suggesting_anchor
2016335896,multilingual_lexicon,project_le-simple building_harmonized harmonized_syntactic-semantic syntactic-semantic_lexicon european_language language_aimed human_language semantic_information information_spanning ontological_typing lexical_semantics language_engineering accessing_semantic semantic_information
4253608092,simulating_swanson raynaud-fish_oil,ha_resulted biomedical_context swanson_ha corroborated_experimentally natural_language biomedical_unified unified_medical medical_language semantic_information successfully_simulate simulate_swanson connecting_raynaud fish_oil magnesium_deficiency
2068649023,letter_cross-language clef_campaign,clef_cross-language forum_series information_retrieval european_language
2166769854,lexical_semantics,modern_computational computational_lexical lexical_semantics semantics_reached lexical_rule formal_semantics lexical_meaning organizing_principle dynamic_resource descriptive_coverage task-oriented_ideology generative_lexicon ontologic_semantic lexical_semantics
2048592642,bootstrapping_algorithm sense_disambiguation,bootstrapping_algorithm sense_disambiguation input_text semantic_tagged tagged_corpus correct_sense sense_tagged
2026914640,,curriculum_initiative national_literacy numeracy_hour scrutiny_addressing differential_teaching teaching_generic generic_teaching teaching_effectiveness position_ha learning_difficulty reject_distinctive teaching_strategy pedagogic_principle
2064926943,british_population,personality_scale scale_cpi cpi_opq opq_cm5 opq32n_firo-b british_population older_people conscientious_traditional le_sociable sociable_outgoing career_motivated assertiveness_independence independence_worrying fluid_intelligence intelligence_personality older_age younger_age
1985039455,parallel_execution prolog_program,logic_programming programming_researcher field_realized logic_program referential_transparency logic_program program_interesting interesting_candidate parallel_execution logic_programming programming_frequently irregular_computation dynamic_data data_structure corresponding_parallelizing parallelizing_compiler potentially_interesting comprehensive_survey issue_arising parallel_execution logic_programming programming_language field_focus challenge_emerging parallel_execution prolog_program shared_memory memory_implementation or-parallelism_and-parallelism memory_management management_compile-time execution_visualization
2094661073,,person_monitor news_coverage news_story single_sentence news_topic constructing_temporal
2009127522,,consultancy_project reduce_accident danish_sugar sugar_factory steady_decline explanation_following multi_disciplinary metaphor_suggests conscious_creative fostering_unconscious unconscious_learning sugar_project unconscious_learning learning_explains image_story story_narrative fairy_tale le_weight formal_conceptual conceptual_learning
2011712930,,interpreter_working italian_television invisible_black black_box principal_factor factor_affecting comfort_factor italian_talk traditional_norm emotainment_visible visible_involvement successful_interpreter double_bind multivariate_mediation mediation_encompassing perceptual_position
4254747961,,reviewed_cropley learning_dijkstra dijkstra_sanne multimedia_learning perspective_hartle kamp_di trainer_latchem latchem_colin century_learning beaty_liz learning_parkin parkin_margaret margaret_tale coaching_yates yates_chris educational_assessment assessment_frindte frindte_wolfgang miller_elizabeth internet_resource resource_directory directory_monk osborne_jonathan science_teaching teaching_moxley keeping_student education_stone stone_randi
2139130996,multicriteria_classification,predefined_homogenous ordinal_methodology addressing_classification statistic_econometrics econometrics_artificial artificial_intelligent multicriteria_decision decision_aiding aiding_mcda mcda_classification classification_sorting mcda_classification classification_sorting software_implementation
2136495792,comparative_genomics protein_involved rna_metabolism,rna_metabolism transcript_translation translation_rna rna_degradation evolutionarily_conserved cell_physiology comprehensive_genome-wide genome-wide_census non-enzymatic_protein protein_domain domain_involved rna_metabolism sequence_profile rna_metabolism protein_repertoire bacteria_archaea greatest_fraction fraction_seen parasitic_bacteria small_genome protein_domain domain_involved rna_metabolism ancestor_luca rna_metabolism parsimony-based_evolutionary orthologous_protein luca_possessed basal_translation methylation_pseudouridylation rna_degradation ancient_domain low-specificity_protein rna_world world_framework rna_metabolism rna_metabolism metabolism_coincides mitochondrial_endosymbiosis involved_emergence eukaryote-specific_rna-binding rna-binding_domain vast_expansion domain_mark evolutionary_history rna_metabolism undetected_enzyme
2028210197,sequential_quadratic quadratic_programming nondifferentiable_exact exact_penalty constraint_degeneracy,
2040022066,text-based_knowledge,volume_complexity knowledge_expressed information_retrieval text_searching information_extraction extract_automatically fine-grained_term term_corresponding entity_referred term_information information_extraction more-complex_structure interpretive_context biological_data
2034698323,lexical_tuning,lexical_sense lexical_tuning lexical_closeness lexical_rule artificial_intelligence intelligence_ai corpus_input input_lexicon sense_extension current_markup sense_discrimination discrimination_wsd sense_extension sense_extension extension_heuristic current_paradigm
2164948865,semidefinite_program nonlinear_programming,
2031868269,extracting_biological,accelerates_biologist information_explosion explosion_biologist biologist_communicate precise_biological biological_term biological_database examines_emerging access_biological biological_resource information_extraction extraction_ha natural_language information_extraction news_story balanced_precision identifying_person person_organization multiple_factor shared_training progress_lack annotated_training training_data biological_task task_pervasive pervasive_ambiguity term_frequent real_biological lexical_matching matching_exercise identifying_biological named_entity entity_tagging
2093756022,automatic_categorisation european_patent patent_office,natural_language european_patent patent_office office_epo classifying_newly technical_area area_precision technical_field training_material ocr_scan highest_cluster technical_examiner applicability_confusion confusion_matrix partial_classifying identifying_potentially citation_extracting extracting_bibliographic bibliographic_data patent_cited document-relevance_ranking cross-lingual_dictionary
2022083943,,computational_lexicon lexicon_encoding encoding_morphological morphological_syntactic semantic_information experimental_open cooperative_educational educational_environment classroom_environment internet_correspondence foreign_language
2097883024,generalized_minimum minimum_distance distance_decoding reed_solomon solomon_code,generalized_minimum minimum_distance distance_gmd gmd_decoding soft-decision_decoding soft-decision_decoding coding_gain hard-decision_decoding ha_concentrated convolutional_code gmd_decoding welch-berlekamp_algorithm gmd_decoder decoder_ha xilinx_fpga
2152058947,sense_disambiguation unrestricted_text,automatic_disambiguating english_text noun_taxonomy wordnet_lexical lexical_knowledge lexical_ambiguity hierarchic_organization lexical_entry semantic_concordance concordance_corpus corpus_semcor electronic_encyclopaedia encyclopaedia_microsoft encarta_encyclopaedia encyclopaedia_deluxe correct_resolution
1603773285,,large-population_speaker speaker_identification neuro-linguistic_programming programming_nlp wavelet_transform transform_cwt timit_database vowel_sound cwt_space nlp_representation nlp_representation priori_gaussian probability_density speaker_identification identification_strategy strategy_combine 1d_signal voice_waveform systematically_studied mental_representation mechanical_aspect vocal_tract
