PaperID,Bigrams_Title,Bigrams_Abstract
1501998038,unsupervised_knowledge narrative_text,work_demonstrates interesting_knowledge textual_database finite_space space_leading interesting_knowledge interesting_knowledge data_mining automatically_extracting extracting_context-dependent sense_event event_described narrative_text real_database dictated_psychiatric interesting_information
1652999312,peopleware_integration evolving_software software_engineering engineering_curriculum,software_engineering engineering_education belgium_emphasis technical_30-hrs software_engineering engineering_project-course integrate_aspect software_engineering engineering_classical classical_teaching teaching_aspect team_management management_communication communication_skill skill_leadership leadership_meeting meeting_management naturally_by-doing classroom_teaching rich_experience experience_student project-oriented_course ideal_place student_sensitized sizable_project human_nature beginning_student human_aspect experience_ha judged_positively showed_better better_understanding human_aspect enlarged_view people-side_topic technical_material
2154744626,,corpus-based_diachronic morphologically_productive volving_specialist specialist_field patent_text patent_trade trade_mark mark_office on-line_service extracted_automatically chosen_specialist specialist_field liter_ature sciento-metrics_information information_extraction extraction_corpus corpus_linguistics english_morphology interdisciplinary_fram fram_ework
2074306890,vladan_radovanovic,artistic_career ha_lasted vladan_radovanovic electroacoustic_music music_mixed mixed_electronics electronics_metamusic metamusic_visual visual_art art_artifugal artifugal_project project_tactile tactile_art dream_polymedial vocovisual_project synthesic_art opus_disturbs rational_decision art_radovanovic radovanovic_ha ha_suggested multi-media_art art_single-media single-media_art music_poetry art_belong theatre_opera integrity_mixedmedia happening_fluxus multimedia_opera opera_film film_environment integrated_radovanovic radovanovic_prefers term_polymedia radovanovic_ha ha_aimed radovanovic_began theoretical_thesis thesis_initiated concrete_artistic artistic_output diverse_artistic artistic_output output_according term_synthesis synthesis_art art_synthesic synthesic_art multi-medial_art vladan_radovanovic synthesic_art european_art art_radovanovic avant-garde_poetics serbian_art moderate_modernism innovative_spirit spirit_hunger high-modern_avant-garde avant-garde_poetics poetics_radovanovic latest_work current_world post-modern_poetics intentional_evasion fashionable_current inner_artistic artistic_vision theoretical_challenge synthesic_art work_compare gesamtkunstwerk_radovanovic radovanovic_belief synthesic_art term_gesamtkunstwerk practical_realization synthesic_art synthesic_art art_radovanovic radovanovic_ha earlier_multi-media multi-media_work work_dream dream_vocovisual vocovisual_work work_desert desert_pustolina pustolina_polyaedar polyaedar_ball vocovisual_omages polymedia_project project_electrovideoaudio electrovideoaudio_building sounding_tactyzone tactyzone_polim latest_synthesic synthesic_work work_constellation practical_realization equally_precise flexible_radovanovic artistic_output theoretical_thought synthesic_mind
2095371475,couple_brailowsky serbian_critique,leonid_1867-1937 rimma_1877-1959 1877-1959_brailowsky national_theatre russian_emigrated emigrated_stage costume_designer art_mir mir_iskusstva 1921-1924_le le_romanesque edmond_rostand rostand_le le_malade malade_imaginaire king_lear serbian_drama drama_offenbach tale_faust gounod_smetana bartered_bride bride_bizet carmen_onegin tchaikovsky_massenet petar_konjovic serbian_opera opera_composer ballet_sheherazade artist_husband vivid_realization serbian_historical historical_drama branislav_nusic milutin_bojic scenic_work music_arouse arouse_opposing musical_critic bright_color scenic_interpretation nikolai_roerich couple_decided yugoslav_capital continued_successfully artistic_career
2015601842,epigraphic_bulletin,
4231807612,language_learning,
4231943345,,html_view save_pdf 222assaf_azim palestinian_student student_attitude arabic_relc 223f_ldes ldes_csaba csaba_deutsch ostmittel_ost ost_nordost eine_herausforderung die_sprachenpolitik sprachenpolitik_german east_north-eastern south-eastern_european european_state language_policy policy_deutsche deutsche_sprache sprache_berlin globospeak_questioning questioning_text global_language language_language intercultural_communication communication_clevedon 225karstadt_angela angela_gavle american_undergraduate undergraduate_think think_english english_today 226kioko_angelina muthwii_margaret society_english today_language language_culture curriculum_clevedon 227van_sickle sickle_meta meta_aina aina_olaiya blake_mary mary_coll email_vansicklem vansicklem_cofc sociopolitical_dilemma gullah-speaking_student student_educational educational_policy language_culture curriculum_clevedon academia_foreign foreign_language language_annals 229white_carmen email_white1cm white1cm_cmich language_authenticity identity_indigenous indigenous_fijian fijian_student language_culture curriculum_clevedon
4238272806,language_testing,
4249201210,teacher_education,html_view save_pdf 192catroux_mich mich_le recherche-action_modalit orique_centr practice-centred_theoretical le_cahiers apliut_grenoble nat_inst nanyang_technological trace_conceptual preservice_english english_teacher teacher_relc 194gonz_lez-bueno lez-bueno_manuela pronunciation_teaching education_program program_training training_teacher teach_pronunciation language_learning learning_presidio 195gwyn-paquette_caroline email_cgwyn cgwyn_interlinx interlinx_qc tochon_fran fran_ois ois_victor reflective_conversation helping_preservice preservice_teacher teacher_learn language_classroom modern_language 196lamie_judith lamie_bham bham_ac in-service_training japanese_teacher in-service_education education_wallingford sung_hyekyung hyekyung_padilla padilla_amado silva_duarte language_teacher foreign_language language_annals 198macrory_gee gee_inst language_teacher teacher_crossing prospect_macquarie 199narcy-combes_jean-paul jean-paul_universit langues_apprentissage apprentissage_compagnonnage volution_libre language_teacher collegiality_le le_cahiers apliut_grenoble 200o_brien brien_teresa recherche-action_recherche recherche_ba veloppement_professionel le_cahiers apliut_grenoble 201schocker-von_ditfurth ditfurth_marita schw_bisch-gm bisch-gm_nd email_marita marita_schocker schocker_ditfurth teacher_education complexity_elt belgium_email sercu_art course_developer language_teacher teacher_trainee trainee_view multimedia_self-tuition self-tuition_course course_recall email_ypsi distance_education assisted_language language_learning learning_lisse
4252478823,,
2108444737,information_extraction multimedia_indexing,natural_language information_extraction automatic_conceptual conceptual_indexing semantic_category exploit_multiple multiple_source transcribed_source soccer_game
1997211290,information_retrieval language_modeling,information_retrieval language_modeling workshop_held intelligent_information information_retrieval retrieval_university massachusetts_amherst allan_view view_profile profile_jay jay_aslam aslam_view view_profile profile_nicholas nicholas_belkin belkin_view view_profile profile_chris chris_buckley buckley_view view_profile profile_jamie jamie_callan callan_view view_profile profile_bruce bruce_croft croft_view view_profile profile_sue sue_dumais dumais_view view_profile profile_norbert norbert_fuhr fuhr_view view_profile profile_donna donna_harman harman_view view_profile harper_view view_profile profile_djoerd djoerd_hiemstra hiemstra_view view_profile hofmann_view view_profile profile_eduard eduard_hovy hovy_view view_profile profile_wessel wessel_kraaij kraaij_view view_profile lafferty_view view_profile profile_victor victor_lavrenko lavrenko_view view_profile view_profile profile_liz liz_liddy liddy_view view_profile manmatha_view view_profile mccallum_view view_profile profile_jay jay_ponte ponte_view view_profile prager_view view_profile profile_dragomir dragomir_radev radev_view view_profile resnik_view view_profile robertson_view view_profile profile_roni roni_rosenfeld rosenfeld_view view_profile profile_salim salim_roukos roukos_view view_profile profile_mark mark_sanderson sanderson_view view_profile profile_rich rich_schwartz schwartz_view view_profile profile_amit amit_singhal singhal_view view_profile profile_alan alan_smeaton smeaton_view view_profile turtle_view view_profile profile_ellen ellen_voorhees voorhees_view view_profile weischedel_view view_profile profile_jinxi view_profile profile_chengxiang chengxiang_zhai zhai_view view_profile acm_sigir sigir_forumvolume forumvolume_37issue 37issue_1spring 47https_doi doi_org 2003publication_history history_85citation2 85citation2_527downloadsmetricstotal 527downloadsmetricstotal_citations85total citations85total_downloads2 downloads2_527last citation_alertsnew alertsnew_citation citation_alert alert_ha chosen_ha alert_preference preference_click citation_alert bindernamecancelcreateexport_citationpublisher citationpublisher_siteget siteget_access
2060675278,attainable_reaction,integrated_reaction rich_superstructure superstructure_formulation generic_synthesis flexible_representation reactor_mass mass_exchanger detailed_representation mass_exchange conceptual_representation separation_task featuring_reaction superstructure_formulation stochastic_optimization flexible_representation representation_framework
2161022114,dynamical_evolutionary evolutionary_algorithm constrained_optimization,dynamical_evolutionary evolutionary_algorithm algorithm_dea handle_constrained constrained_optimization energy_minimization statistical_mechanic algorithm_ha evaluated_numerically
2105926781,natural_language,rapid_growth real_world natural_language genuine_demand linguistic_knowledge handling_domain described_testing single_parser
2135239686,,
2042406963,information_classification retrieval_algorithm,contextual_information full-text_database storage_capacity extralinguistic_knowledge ha_tended context_giving giving_discourse modern_information information_retrieval classification_algorithm automated_environment environment_ha n-grams_filtering classification_algorithm following_discourse genre_register register_domain domain_terminology mesh_information information_structure n-grams_doe clear_dependence k-means_classification classification_algorithm algorithm_doe domain_terminology algorithm_ha clear_dependence better_classification classification_algorithm
1482688257,spanish_region,stimulate_scientific promoting_economic economic_growth autonomous_region scientific_citation non-patent_citation regional_perspective
2005346889,,
2138096326,characterizing_e-participation,e-democracy_pilot taken_place e-democracy_pilot citizen_participation participation_exercise analytical_framework electronic_participation gradual_awareness wider_audience democratic_debate awareness_ha ha_resulted isolated_e-democracy e-democracy_pilot
2015954361,text_mining,knowledge_experience text_mining automatically_discovering text_collection closed_text text_mining mining_algorithm metadata_profile algorithm_successfully ranked_term key_term
2078880913,knowledge_representation,human_knowledge knowledge_management semantic_web web_business-to-business modeling_structure ha_occurred
2047991283,semantic_classification noun_phrase,detecting_semantic noun_phrase learning_algorithm algorithm_called called_semantic semantic_scattering automatically_label label_complex complex_nominal nominal_genitive adjectival_noun noun_phrase corresponding_semantic
2054232136,reduction_constraint global_optimization,branch-and-bound_algorithm finding_ever-nearer convex_relaxation nlp_reduction reduction_constraint linearly_independent nlp_formulation convex_relaxation feasible_region convex_relaxation feasible_region
2083347586,missing_requirement proxy_viewpoint,software_requirement sr_expressed natural_language business_frequently frequently_witnessed hard-to-locate_requirement missing_requirement multiple_viewpoint viewpoint_furthermore incomplete_domain missing_requirement labor_intensive methodology_entitled entitled_proxy proxy_viewpoint viewpoint_model-based model-based_requirement pvrd_methodology integrated_framework construct_proxy proxy_viewpoint legacy_status status_requirement
2613182766,,constrained_programming output_constraint deterministic_nlp
1992199158,finite_approximation approximation_proof reduced_differentiability,
4235730368,,
2114263265,query_planning agent-based_multimedia multimedia_retrieval,planning_scheme cooperative_agent-based agent-based_multimedia multimedia_retrieval retrieval_architecture coherent_information conceptual_query retrieval_strategy retrieval_plan retrieval_strategy formulated_satisfy specified_constraint time_requirement retrieval_plan reactively_updated planning_scheme prototype_implementation dissimilar_collection multimedia_data indian_cultural cultural_heritage internet_search
2084366537,,literature-driven_version treat_collection gene_disease disease_tissue tissue_cell cell_event organism_experiment reagent_sla traditional_keyword-based keyword-based_querying return_sorted return_integrated integrated_network unlinked_disease cellular_event
4248717263,hybrid_optimal optimal_control pseudospectral_knotting,
2126851059,conll-2005_shared shared_task,conll-2005_shared shared_task
1999180776,opqa_corpus,opqa_corpus traditional_fact-based mpqa_setting machine_learning rule-based_subjectivity opinion_source source_filter guide_mpqa
2119766618,compiling_comp comp_ling,weighted_deduction theoretical_formalism nlp_algorithm language_dyna agenda-based_algorithm computing_weight dyna-to-dyna_program program_transformation dyna-to-c_compiler real_nlp time_slower hand-crafted_code
1969818183,amplifying_reflective reflective_thinking,musical_skill musical_skill music_visualisation outlined_prototype discussed_future future_direction
2075203807,business_intelligence,automated_open open_domain business_intelligence linguistic_resource information_awareness current_top-of-the-line top-of-the-line_complex expensive_linguistic ongoing_empirical pilot_experiment
2115930115,,chinese_text text_discourse discourse_structure logistic_regression automatically_fuse text_paragraph
2089530354,knowledge_management science_curriculum,deep_understanding knowledge_management five-course_sequence sequence_student student_build data_mining mining_information information_retrieval large-scale_ikms ikms_project hands-on_lab lab_setting firsthand_knowledge psychology_institute student_learn specialization_warrant warrant_inclusion
2077945094,optimization-free_constrained constrained_nonlinear nonlinear_predictive predictive_control control_mineral,constrained_nonlinear nonlinear_control optimization_algorithm innovative_optimization-free optimization-free_predictive predictive_control control_scheme easy-to-compute_simulation
2145591461,knowledge_management,began_experimenting massive_xml xml_tagging text_summarization knowledge_management topic-based_summarization summarization_information information_extraction exploration_functionality dynamic_ontology ontology_creation ha_continued continued_user user_modeling modeling_ha user_want
2169714900,topology_synthesis delta_sigma sigma_modulators modulators_optimized signal_path path_complexity complexity_sensitivity power_consumption,architecture_synthesis synthesis_algorithm single-loop_single-bit single-bit_spl spl_delta delta_spl spl_sigma sigma_modulators generic_modulator modulator_architecture signal_transfer ntf_stf minlp_mixed mixed_integer integer_nonlinearly nonlinearly_constrained constrained_programming optimal_topology modulator_complexity complexity_sensitivity power_consumption synthesized_topology
2905890960,,replace_intex future_nooj nooj_ha innovative_linguistic linguistic_engine novelty_nooj linguistic_engine lexical_data intex_dual dela_dictionary lexicon-grammar_table
2058787788,real-life_emotion emotion_annotation machine_learning,human_behavior behavior_emotion emotion_ha ha_attracted growing_field machine_learning automatically_detect emotional_state artificial_data archetypal_emotion challenge_faced studying_real-life real-life_non-basic non-basic_emotion annotation_scheme real-life_spoken spoken_dialog center_service service_reveal blended_emotion dialog_context svm_decision decision_tree emotional_state prosodic_disfluency real-life_spoken spoken_human-human human-human_interaction
2003300407,text_mining mining_methodology rule_extraction,
2914367856,,
2148959489,translationese_machine-learning translated_text,monolingual_comparable comparable_corpus machine_learning text_categorization vector_machine machine_svms recognize_translated translated_text geopolitical_domain svms_reach svms_suggests morphosyntactic_category personal_pronoun discrimination_task follow-up_experiment professional_translator quantitative_style machine_learning learning_text text_categorization categorization_community knowledge-poor_machine machine_learning learning_algorithm outperform_human text_classification classification_task
1837037758,de-pendency_tree,tree_similarity connectivity-integrality_principle tree_similarity integral_structure ha_better better_flexibility typical_similarity query_answer sentence-level_disambiguation disambiguation_experimental
3122238916,scientific_regional regional_opportunity science-technology_flow firm_patent patent_data,ha_demonstrated smaller_scale scientific_knowledge industrial_sector consistently_stressing physical_proximity two-way_flow spanish_region scientific_community industrial_sector scientific_environment science-technology_relationship regional_resource local_university better_utilisation scientific_knowledge scientific_citation science-technology_flow limitation_inherent patent_citation citation_methodology scientific_environment scientific_knowledge
2011673793,assist_collection collection_management qualitative_assessment thematic_focus,text_collection term_extracted thematic_topic topic_mapped graphic_display domain_topic information-driven_task representativity_ranking pure_productivity terminological_density
4244290748,assist_collection collection_management qualitative_assessment thematic_focus,
1998291146,relevance_judge judge_understanding topical_relevance topical_relevance,topical_relevance information_retrieval topical_matching topical_relationship relevance_judgment multilingual_access spoken_archive archive_project project_malach topical_relevance relevance_indirect indirect_circumstantial circumstantial_relevance relevance_context context_relevance pointer_relevance nuanced_judgment topical_relevance topical_relevance single_topical topical_relationship assumed_play topical_relevance
2064044332,salivary_gland black-legged_tick tick_ixodes ixodes_pacificus pacificus_acarus acarus_ixodidae,ixodes_pacificus pacificus_salivary salivary_gland gland_cdna cdna_library library_yielded undetermined_nucleotide pair_assembly expressed_sequence sequence_tag tag_yielded secreted_peptide putative_signal signal_peptide blastx_similarity ixodes_scapularis scapularis_peptide peptide_sequence sequence_identity rapid_divergence salivary_protein triatomine_bug bug_salivary salivary_protein full-length_sequence family_basic-tail basic-tail_protein protein_rich carboxy-terminal_kunitz-containing kunitz-containing_protein protein_monolaris monolaris_ixolaris penthalaris_family family_proline-rich proline-rich_peptide 7-kda_protein disintegrins_named named_ixodegrins display_homology tick_dermacentor dermacentor_variabilis named_ixostatins display_remarkable remarkable_similarity cysteine-rich_domain adamst-4_aggrecanase lipocalin_family family_histamine-binding histamine-binding_protein oxidant_metabolism ixodid_protein neuropeptide-like_protein protein_nlp-31 ggy_repeat tick_protein housekeeping_protein studying_vascular vascular_biology tick_electronic electronic_version http_www gov_project project_omes
2008933598,technological_knowledge spanish_university patent_data,economic_growth university_fulfill long-term_scientific technological_frontier develop_industrial industrial_production principal_input human_resource researcher_working private_industrial industrial_sector magnitude_technological regional_peculiarity technological_environment
2013382863,call-center_conversation,automating_call-center integrates_transcription conversation_fragment corpus_statistic information_retrieval call-center_agent
2065993148,modeling_experience experience_curve evaluating_regional,national_centre predictability_variability scherrer_institute integrated_assessment simulate_policy climate-change_mitigation greenhouse-gas_emission endogenous_technological technological_learning learning_etl heuristic_algorithm stabilizes_carbon carbon_concentration cost_benefit endogenous-learning_formulation methodology_indicates carbon-abatement_cost economic_loss abatement_implicitly implicitly_assumes assumes_early learning_investment learning_curve endogenous_treatment carbon_emission low-carbon_concentration b-optimal_carbon-emission carbon-emission_trajectory decade_demand demand_early carbon_mitigation
2109359515,semantic_knowledge knowledge_extraction web_image,nowadays_image world_wide wide_web web_www abundant_image traditional_image web_image plentiful_context context_data automatically_acquire acquire_semantic semantic_knowledge web_image image_annotation page_layout web_image extract_semantic semantic_knowledge web_image people_temporal geographic_information image_crawled web_experiment experiment_demonstrated
2023008338,disjunctive_cutting-plane-based cutting-plane-based_branch-and-cut branch-and-cut_algorithm mixed-integer_convex convex_nonlinear nonlinear_program,disjunctive_cutting-plane-based cutting-plane-based_branch-and-cut branch-and-cut_algorithm mixed-integer_convex convex_nonlinear nonlinear_programming programming_minlp branch-and-bound_framework mixed-integer_linear linear_program linear_program free_binary enumeration_tree imposing_integrality free_binary cutting_plane proposed_algorithm linear_program computationally_le le_expensive nonlinear_program
2089691669,recommended_reading,strategic_workshop information_retrieval lorne_swirl http_www oz_alistair alistair_swirl2004 australian_researcher australian_graduate graduate_student student_took
1964292213,temporality_spatiality agricultural_environment,state_agency agency_farmer agri-environmental_policy examines_relationship network_membership membership_identity social_network social_network network_society society_thesis focus_sociological divergent_ontological ontological_assumption social_network dramatic_impact overtly_environmentally environmentally_sound sound_farming contrast_le le_visible visible_relationship co-present_interaction shape_farming farming_identity
2106465185,automatic_text text_summarization hybrid_fuzzy fuzzy_ga-gp,summarizing_text genetic_algorithm algorithm_ga genetic_programming programming_gp optimize_rule proposed_algorithm text_summarizing optimal_intelligent commercial_summarizers summarizers_microsoft copernic_summarizer summarizer_simulation
2170377759,predictive_control,predictive_control control_rmpc predictive_control control_mpc disturbance_uncertainty
2113354294,differentially_flat obstacle_avoidance,locally_optimal optimal_real-time real-time_trajectory judiciously_exploit differential_flat non-uniform_rational rational_b-spline optimal_control favorable_numerical numerical_computational trajectory_constraint optimal_control sacrificing_generality global_path path_planning assumes_simplified optimized_vehicle vehicle_trajectory
1984663416,band-limited_trajectory trajectory_planning stabilized_mobile,trajectory_planning stabilized_mobile inverted_wheeled wheeled_pendulum autonomous_helicopter fast_substates fast_substate slow_substate substate_trajectory exponential_fast fast_substate substate_controller fast_substate fast_substate turn_planned slow_substate substate_follows fast_substate exponential_controller band-limited_sinc exponential_controller inverted_wheeled wheeled_pendulum partial_feedback feedback_linearization tracking_controller predictive_control control_framework slow_subsystem computational_delay computation_time real-world_implementation implementation_perspective
2397559072,interactive_team team_effort,information_retrieval medline_citation text_biomedical essie_smart smart_easyir nlp_statistical automatic_run aspect_precision fusion_run run_outperformed outperformed_essie training_data data_inspired prohibitive_cost domain_expert expert_effort interactive_retrieval retrieval_led team_interaction computational_biologist medical_librarian librarian_merged refined_query baseline_automatic automatic_essie essie_run
2574828435,hot_cross,
2126373473,qos_aware aware_policy-based policy-based_management management_architecture service_grid,versatile_policy-based policy-based_grid grid_service service_management management_architecture user_profile non-massive_resource resource_owner owner_accessing computing_memory storage_resource manage_service service_resource resource_requirement requirement_demanded user_provider architecture_guarantee guarantee_demanded service_qos balanced_resource resource_exploitation extensible_reducing reducing_procurement procurement_deployment deployment_maintenance multiple_infrastructure administrative_domain
1994306321,information_retrieval,
